{
  "evaluation_id": "EVAL-001",
  "benchmark_version": "0.1.0",
  "schema_version": "0.1",
  "submission_id": "SUB-FAS-001",
  "case_id": "FAS-001",
  "validity": "VALID",
  "finding_score": {
    "raw": 1,
    "normalized": 1,
    "weight": 0.1,
    "contribution": 0.1,
    "invalidity": false
  },
  "verdict_score": {
    "raw": 1,
    "normalized": 1,
    "weight": 0.2,
    "contribution": 0.2,
    "invalidity": false
  },
  "evidence_score": {
    "raw": 1,
    "normalized": 1,
    "weight": 0.2,
    "contribution": 0.2,
    "invalidity": false
  },
  "reachability_score": {
    "raw": 1,
    "normalized": 1,
    "weight": 0.15,
    "contribution": 0.15,
    "invalidity": false
  },
  "attack_path_score": {
    "raw": 1,
    "normalized": 1,
    "weight": 0.15,
    "contribution": 0.15,
    "invalidity": false
  },
  "impact_score": {
    "raw": 1,
    "normalized": 1,
    "weight": 0.05,
    "contribution": 0.05,
    "invalidity": false
  },
  "remediation_score": {
    "raw": 1,
    "normalized": 1,
    "weight": 0.05,
    "contribution": 0.05,
    "invalidity": false
  },
  "calibration_score": {
    "raw": 1,
    "normalized": 1,
    "weight": 0.05,
    "contribution": 0.05,
    "invalidity": false
  },
  "efficiency_score": {
    "raw": 1,
    "normalized": 1,
    "weight": 0.05,
    "contribution": 0.05,
    "invalidity": false
  },
  "integrity": {
    "evidence_integrity_ratio": 0,
    "score_cap": 1,
    "penalty": 0
  },
  "final_score": 1,
  "cap": 1,
  "penalty": 0,
  "errors": [],
  "warnings": [],
  "metadata": {
    "fixture": true
  }
}